{
  "schema_version": "datapan.health-bounded-observation-run.v1",
  "producer": {"repository": "StatPan/datapan-health", "revision": "0123456789012345678901234567890123456789"},
  "registry": {"source_revision": "9876543210987654321098765432109876543210", "source_sha256": "ffffffffffffffffffffffffffffffffffffffffffffffffffffffffffffffff", "manifest_sha256": "aaaaaaaaaaaaaaaaaaaaaaaaaaaaaaaaaaaaaaaaaaaaaaaaaaaaaaaaaaaaaaaa", "policy_sha256": "bbbbbbbbbbbbbbbbbbbbbbbbbbbbbbbbbbbbbbbbbbbbbbbbbbbbbbbbbbbbbbbb"},
  "run": {"run_id": "health-run-fixture-0002", "started_at": "2026-07-22T00:00:00Z", "completed_at": "2026-07-22T00:00:20Z", "shard_count": 8, "batch_size": 100, "max_parallel": 2, "timeout_ms": 20000},
  "shards": [
    {"index": 0, "shard_digest": "0000000000000000000000000000000000000000000000000000000000000000", "scope": {"provider": "data_go_kr", "subject": "runtime_freshness_rotating_shard"}, "manifest_sha256": "aaaaaaaaaaaaaaaaaaaaaaaaaaaaaaaaaaaaaaaaaaaaaaaaaaaaaaaaaaaaaaaa", "policy_sha256": "bbbbbbbbbbbbbbbbbbbbbbbbbbbbbbbbbbbbbbbbbbbbbbbbbbbbbbbbbbbbbbbb", "terminal_state": "unknown", "completed": false, "receipt_available": false, "redaction": {"secret_values_removed": true, "secret_hashes_removed": true, "authorization_headers_removed": true, "credential_bearing_urls_removed": true, "raw_provider_text_removed": true, "raw_provider_urls_removed": true, "response_bodies_removed": true, "response_rows_removed": true, "user_identity_removed": true}},
    {"index": 1, "shard_digest": "1111111111111111111111111111111111111111111111111111111111111111", "scope": {"provider": "data_go_kr", "subject": "runtime_freshness_rotating_shard"}, "manifest_sha256": "aaaaaaaaaaaaaaaaaaaaaaaaaaaaaaaaaaaaaaaaaaaaaaaaaaaaaaaaaaaaaaaa", "policy_sha256": "bbbbbbbbbbbbbbbbbbbbbbbbbbbbbbbbbbbbbbbbbbbbbbbbbbbbbbbbbbbbbbbb", "terminal_state": "unknown", "completed": false, "receipt_available": false, "redaction": {"secret_values_removed": true, "secret_hashes_removed": true, "authorization_headers_removed": true, "credential_bearing_urls_removed": true, "raw_provider_text_removed": true, "raw_provider_urls_removed": true, "response_bodies_removed": true, "response_rows_removed": true, "user_identity_removed": true}},
    {"index": 2, "shard_digest": "2222222222222222222222222222222222222222222222222222222222222222", "scope": {"provider": "data_go_kr", "subject": "runtime_freshness_rotating_shard"}, "manifest_sha256": "aaaaaaaaaaaaaaaaaaaaaaaaaaaaaaaaaaaaaaaaaaaaaaaaaaaaaaaaaaaaaaaa", "policy_sha256": "bbbbbbbbbbbbbbbbbbbbbbbbbbbbbbbbbbbbbbbbbbbbbbbbbbbbbbbbbbbbbbbb", "terminal_state": "unknown", "completed": false, "receipt_available": false, "redaction": {"secret_values_removed": true, "secret_hashes_removed": true, "authorization_headers_removed": true, "credential_bearing_urls_removed": true, "raw_provider_text_removed": true, "raw_provider_urls_removed": true, "response_bodies_removed": true, "response_rows_removed": true, "user_identity_removed": true}},
    {"index": 3, "shard_digest": "3333333333333333333333333333333333333333333333333333333333333333", "scope": {"provider": "data_go_kr", "subject": "runtime_freshness_rotating_shard"}, "manifest_sha256": "aaaaaaaaaaaaaaaaaaaaaaaaaaaaaaaaaaaaaaaaaaaaaaaaaaaaaaaaaaaaaaaa", "policy_sha256": "bbbbbbbbbbbbbbbbbbbbbbbbbbbbbbbbbbbbbbbbbbbbbbbbbbbbbbbbbbbbbbbb", "terminal_state": "unknown", "completed": false, "receipt_available": false, "redaction": {"secret_values_removed": true, "secret_hashes_removed": true, "authorization_headers_removed": true, "credential_bearing_urls_removed": true, "raw_provider_text_removed": true, "raw_provider_urls_removed": true, "response_bodies_removed": true, "response_rows_removed": true, "user_identity_removed": true}},
    {"index": 4, "shard_digest": "4444444444444444444444444444444444444444444444444444444444444444", "scope": {"provider": "data_go_kr", "subject": "runtime_freshness_rotating_shard"}, "manifest_sha256": "aaaaaaaaaaaaaaaaaaaaaaaaaaaaaaaaaaaaaaaaaaaaaaaaaaaaaaaaaaaaaaaa", "policy_sha256": "bbbbbbbbbbbbbbbbbbbbbbbbbbbbbbbbbbbbbbbbbbbbbbbbbbbbbbbbbbbbbbbb", "terminal_state": "unknown", "completed": false, "receipt_available": false, "redaction": {"secret_values_removed": true, "secret_hashes_removed": true, "authorization_headers_removed": true, "credential_bearing_urls_removed": true, "raw_provider_text_removed": true, "raw_provider_urls_removed": true, "response_bodies_removed": true, "response_rows_removed": true, "user_identity_removed": true}},
    {"index": 5, "shard_digest": "5555555555555555555555555555555555555555555555555555555555555555", "scope": {"provider": "data_go_kr", "subject": "runtime_freshness_rotating_shard"}, "manifest_sha256": "aaaaaaaaaaaaaaaaaaaaaaaaaaaaaaaaaaaaaaaaaaaaaaaaaaaaaaaaaaaaaaaa", "policy_sha256": "bbbbbbbbbbbbbbbbbbbbbbbbbbbbbbbbbbbbbbbbbbbbbbbbbbbbbbbbbbbbbbbb", "terminal_state": "unknown", "completed": false, "receipt_available": false, "redaction": {"secret_values_removed": true, "secret_hashes_removed": true, "authorization_headers_removed": true, "credential_bearing_urls_removed": true, "raw_provider_text_removed": true, "raw_provider_urls_removed": true, "response_bodies_removed": true, "response_rows_removed": true, "user_identity_removed": true}},
    {"index": 6, "shard_digest": "6666666666666666666666666666666666666666666666666666666666666666", "scope": {"provider": "data_go_kr", "subject": "runtime_freshness_rotating_shard"}, "manifest_sha256": "aaaaaaaaaaaaaaaaaaaaaaaaaaaaaaaaaaaaaaaaaaaaaaaaaaaaaaaaaaaaaaaa", "policy_sha256": "bbbbbbbbbbbbbbbbbbbbbbbbbbbbbbbbbbbbbbbbbbbbbbbbbbbbbbbbbbbbbbbb", "terminal_state": "unknown", "completed": false, "receipt_available": false, "redaction": {"secret_values_removed": true, "secret_hashes_removed": true, "authorization_headers_removed": true, "credential_bearing_urls_removed": true, "raw_provider_text_removed": true, "raw_provider_urls_removed": true, "response_bodies_removed": true, "response_rows_removed": true, "user_identity_removed": true}},
    {"index": 7, "shard_digest": "7777777777777777777777777777777777777777777777777777777777777777", "scope": {"provider": "data_go_kr", "subject": "runtime_freshness_rotating_shard"}, "manifest_sha256": "aaaaaaaaaaaaaaaaaaaaaaaaaaaaaaaaaaaaaaaaaaaaaaaaaaaaaaaaaaaaaaaa", "policy_sha256": "bbbbbbbbbbbbbbbbbbbbbbbbbbbbbbbbbbbbbbbbbbbbbbbbbbbbbbbbbbbbbbbb", "terminal_state": "unknown", "completed": false, "timed_out": true, "receipt_available": false, "redaction": {"secret_values_removed": true, "secret_hashes_removed": true, "authorization_headers_removed": true, "credential_bearing_urls_removed": true, "raw_provider_text_removed": true, "raw_provider_urls_removed": true, "response_bodies_removed": true, "response_rows_removed": true, "user_identity_removed": true}}
  ],
  "aggregate": {"terminal_state": "unknown", "completeness": "partial", "timed_out": true},
  "redaction": {"secret_values_removed": true, "secret_hashes_removed": true, "authorization_headers_removed": true, "credential_bearing_urls_removed": true, "raw_provider_text_removed": true, "raw_provider_urls_removed": true, "response_bodies_removed": true, "response_rows_removed": true, "user_identity_removed": true}
}
