{
  "schema_version": "datapan.health-bounded-observation-run.v1",
  "producer": {"repository": "StatPan/datapan-health", "revision": "0123456789012345678901234567890123456789"},
  "registry": {"source_revision": "9876543210987654321098765432109876543210", "source_sha256": "ffffffffffffffffffffffffffffffffffffffffffffffffffffffffffffffff", "manifest_sha256": "aaaaaaaaaaaaaaaaaaaaaaaaaaaaaaaaaaaaaaaaaaaaaaaaaaaaaaaaaaaaaaaa", "policy_sha256": "bbbbbbbbbbbbbbbbbbbbbbbbbbbbbbbbbbbbbbbbbbbbbbbbbbbbbbbbbbbbbbbb"},
  "run": {"run_id": "health-run-fixture-0001", "started_at": "2026-07-22T00:00:00Z", "completed_at": "2026-07-22T00:00:20Z", "shard_count": 8, "batch_size": 100, "max_parallel": 2, "timeout_ms": 20000},
  "shards": [
    {"index": 0, "shard_digest": "0000000000000000000000000000000000000000000000000000000000000000", "scope": {"provider": "data_go_kr", "subject": "runtime_freshness_rotating_shard"}, "manifest_sha256": "aaaaaaaaaaaaaaaaaaaaaaaaaaaaaaaaaaaaaaaaaaaaaaaaaaaaaaaaaaaaaaaa", "policy_sha256": "bbbbbbbbbbbbbbbbbbbbbbbbbbbbbbbbbbbbbbbbbbbbbbbbbbbbbbbbbbbbbbbb", "terminal_state": "verified", "completed": true, "receipt_available": true, "receipt_path": "shards/0/receipt.json", "observed_at": "2026-07-22T00:00:01Z", "receipt_sha256": "ba288b8f2b9d4f22e134e293dfe4e0bce7c1d5db47343675661857fc6416e68e", "redaction": {"secret_values_removed": true, "secret_hashes_removed": true, "authorization_headers_removed": true, "credential_bearing_urls_removed": true, "raw_provider_text_removed": true, "raw_provider_urls_removed": true, "response_bodies_removed": true, "response_rows_removed": true, "user_identity_removed": true}},
    {"index": 1, "shard_digest": "1111111111111111111111111111111111111111111111111111111111111111", "scope": {"provider": "data_go_kr", "subject": "runtime_freshness_rotating_shard"}, "manifest_sha256": "aaaaaaaaaaaaaaaaaaaaaaaaaaaaaaaaaaaaaaaaaaaaaaaaaaaaaaaaaaaaaaaa", "policy_sha256": "bbbbbbbbbbbbbbbbbbbbbbbbbbbbbbbbbbbbbbbbbbbbbbbbbbbbbbbbbbbbbbbb", "terminal_state": "verified", "completed": true, "receipt_available": true, "receipt_path": "shards/1/receipt.json", "observed_at": "2026-07-22T00:00:02Z", "receipt_sha256": "27965949fe73afefab252b84c7459146686d3162c1aff4f1625a45fd1d250dd2", "redaction": {"secret_values_removed": true, "secret_hashes_removed": true, "authorization_headers_removed": true, "credential_bearing_urls_removed": true, "raw_provider_text_removed": true, "raw_provider_urls_removed": true, "response_bodies_removed": true, "response_rows_removed": true, "user_identity_removed": true}},
    {"index": 2, "shard_digest": "2222222222222222222222222222222222222222222222222222222222222222", "scope": {"provider": "data_go_kr", "subject": "runtime_freshness_rotating_shard"}, "manifest_sha256": "aaaaaaaaaaaaaaaaaaaaaaaaaaaaaaaaaaaaaaaaaaaaaaaaaaaaaaaaaaaaaaaa", "policy_sha256": "bbbbbbbbbbbbbbbbbbbbbbbbbbbbbbbbbbbbbbbbbbbbbbbbbbbbbbbbbbbbbbbb", "terminal_state": "verified", "completed": true, "receipt_available": true, "receipt_path": "shards/2/receipt.json", "observed_at": "2026-07-22T00:00:03Z", "receipt_sha256": "5a26216d79f0fddee3bc70f300c8d74ef7d384ecf5544817c51a7d64ee71137c", "redaction": {"secret_values_removed": true, "secret_hashes_removed": true, "authorization_headers_removed": true, "credential_bearing_urls_removed": true, "raw_provider_text_removed": true, "raw_provider_urls_removed": true, "response_bodies_removed": true, "response_rows_removed": true, "user_identity_removed": true}},
    {"index": 3, "shard_digest": "3333333333333333333333333333333333333333333333333333333333333333", "scope": {"provider": "data_go_kr", "subject": "runtime_freshness_rotating_shard"}, "manifest_sha256": "aaaaaaaaaaaaaaaaaaaaaaaaaaaaaaaaaaaaaaaaaaaaaaaaaaaaaaaaaaaaaaaa", "policy_sha256": "bbbbbbbbbbbbbbbbbbbbbbbbbbbbbbbbbbbbbbbbbbbbbbbbbbbbbbbbbbbbbbbb", "terminal_state": "verified", "completed": true, "receipt_available": true, "receipt_path": "shards/3/receipt.json", "observed_at": "2026-07-22T00:00:04Z", "receipt_sha256": "96cfb373d99bd58bda9bb575c1d001487ee80de7699e5cc287ec0129955ce7f2", "redaction": {"secret_values_removed": true, "secret_hashes_removed": true, "authorization_headers_removed": true, "credential_bearing_urls_removed": true, "raw_provider_text_removed": true, "raw_provider_urls_removed": true, "response_bodies_removed": true, "response_rows_removed": true, "user_identity_removed": true}},
    {"index": 4, "shard_digest": "4444444444444444444444444444444444444444444444444444444444444444", "scope": {"provider": "data_go_kr", "subject": "runtime_freshness_rotating_shard"}, "manifest_sha256": "aaaaaaaaaaaaaaaaaaaaaaaaaaaaaaaaaaaaaaaaaaaaaaaaaaaaaaaaaaaaaaaa", "policy_sha256": "bbbbbbbbbbbbbbbbbbbbbbbbbbbbbbbbbbbbbbbbbbbbbbbbbbbbbbbbbbbbbbbb", "terminal_state": "verified", "completed": true, "receipt_available": true, "receipt_path": "shards/4/receipt.json", "observed_at": "2026-07-22T00:00:05Z", "receipt_sha256": "798a771354e1f10535479451f7c9ed0348e2516d36e1b49666f34f771a851511", "redaction": {"secret_values_removed": true, "secret_hashes_removed": true, "authorization_headers_removed": true, "credential_bearing_urls_removed": true, "raw_provider_text_removed": true, "raw_provider_urls_removed": true, "response_bodies_removed": true, "response_rows_removed": true, "user_identity_removed": true}},
    {"index": 5, "shard_digest": "5555555555555555555555555555555555555555555555555555555555555555", "scope": {"provider": "data_go_kr", "subject": "runtime_freshness_rotating_shard"}, "manifest_sha256": "aaaaaaaaaaaaaaaaaaaaaaaaaaaaaaaaaaaaaaaaaaaaaaaaaaaaaaaaaaaaaaaa", "policy_sha256": "bbbbbbbbbbbbbbbbbbbbbbbbbbbbbbbbbbbbbbbbbbbbbbbbbbbbbbbbbbbbbbbb", "terminal_state": "verified", "completed": true, "receipt_available": true, "receipt_path": "shards/5/receipt.json", "observed_at": "2026-07-22T00:00:06Z", "receipt_sha256": "e90e58162de5b071bfbd84bf50ebdc85d020e4d7021c718aed8a4c85812bc0a4", "redaction": {"secret_values_removed": true, "secret_hashes_removed": true, "authorization_headers_removed": true, "credential_bearing_urls_removed": true, "raw_provider_text_removed": true, "raw_provider_urls_removed": true, "response_bodies_removed": true, "response_rows_removed": true, "user_identity_removed": true}},
    {"index": 6, "shard_digest": "6666666666666666666666666666666666666666666666666666666666666666", "scope": {"provider": "data_go_kr", "subject": "runtime_freshness_rotating_shard"}, "manifest_sha256": "aaaaaaaaaaaaaaaaaaaaaaaaaaaaaaaaaaaaaaaaaaaaaaaaaaaaaaaaaaaaaaaa", "policy_sha256": "bbbbbbbbbbbbbbbbbbbbbbbbbbbbbbbbbbbbbbbbbbbbbbbbbbbbbbbbbbbbbbbb", "terminal_state": "verified", "completed": true, "receipt_available": true, "receipt_path": "shards/6/receipt.json", "observed_at": "2026-07-22T00:00:07Z", "receipt_sha256": "b30f9cd7d1969959c4d38cbd05f27747fab8bc613ffff127bbf990a7d7061aa5", "redaction": {"secret_values_removed": true, "secret_hashes_removed": true, "authorization_headers_removed": true, "credential_bearing_urls_removed": true, "raw_provider_text_removed": true, "raw_provider_urls_removed": true, "response_bodies_removed": true, "response_rows_removed": true, "user_identity_removed": true}},
    {"index": 7, "shard_digest": "7777777777777777777777777777777777777777777777777777777777777777", "scope": {"provider": "data_go_kr", "subject": "runtime_freshness_rotating_shard"}, "manifest_sha256": "aaaaaaaaaaaaaaaaaaaaaaaaaaaaaaaaaaaaaaaaaaaaaaaaaaaaaaaaaaaaaaaa", "policy_sha256": "bbbbbbbbbbbbbbbbbbbbbbbbbbbbbbbbbbbbbbbbbbbbbbbbbbbbbbbbbbbbbbbb", "terminal_state": "verified", "completed": true, "receipt_available": true, "receipt_path": "shards/7/receipt.json", "observed_at": "2026-07-22T00:00:08Z", "receipt_sha256": "1ff76e21c8cdfdf3fdbb66a4d7355ed5b6c40ecd3c80f54fdaca2a01d05d7d25", "redaction": {"secret_values_removed": true, "secret_hashes_removed": true, "authorization_headers_removed": true, "credential_bearing_urls_removed": true, "raw_provider_text_removed": true, "raw_provider_urls_removed": true, "response_bodies_removed": true, "response_rows_removed": true, "user_identity_removed": true}}
  ],
  "aggregate": {"terminal_state": "verified", "completeness": "complete", "timed_out": false},
  "redaction": {"secret_values_removed": true, "secret_hashes_removed": true, "authorization_headers_removed": true, "credential_bearing_urls_removed": true, "raw_provider_text_removed": true, "raw_provider_urls_removed": true, "response_bodies_removed": true, "response_rows_removed": true, "user_identity_removed": true}
}
